<data xmlns:xsi="http://www.w3.org/2001/XMLSchema-instance" xsi:noNamespaceSchemaLocation="../schemas/scenes.xsd">
    <scene id="stratis_receptionist_start" type="select">
        <line redirect="stratis_receptionist_main" once="true">"Hello, welcome to the Stratis Hotel. How can I be of assistance?"</line>
        <line redirect="stratis_receptionist_main">"Welcome back. How can I be of assistance?"</line>
    </scene>
    <scene id="stratis_receptionist_main_return">
        <line redirect="stratis_receptionist_main">"Very well. Anything else I can do for you?"</line>
    </scene>
    <scene id="stratis_receptionist_main">
        <choice link="stratis_receptionist_request_room">Do you have any rooms available?</choice>
        <choice link="stratis_receptionist_info">I have some questions.</choice>
        <choice link="stratis_receptionist_end">That will be all.</choice>
    </scene>
    <scene id="stratis_receptionist_request_room">
        <condition>global.purchased_stratis_room != null &amp;&amp; global.purchased_stratis_room</condition>
        <line>He taps the screen in front of him and quickly scans its contents.</line>
        <line>"Yes, it appears we have an available room on the fifth floor. King bed, thirty-inch holoscreen, and a beautiful view of the commercial district. Only 300 credits a night."</line>
        <choice link="stratis_receptionist_purchase_room">I'll take the room.</choice>
        <choice link="stratis_receptionist_main_return">Not right now.</choice>
    </scene>
    <scene id="stratis_receptionist_purchase_room">
        <condition>stat.player.money &gt;= 300</condition>
        <line>
            <line>"Certainly. The room number is 508, on the fifth floor. You can use those elevators over there. Here's your keycard."</line>
            <line>He hands you a white keycard with the Stratis Hotel logo.</line>
            <scriptPost>
                transferItem(to=stat.player.inventory, item="stratis_room_key");
                stat.player.money = stat.player.money - 300;
                global.purchased_stratis_room = true;
            </scriptPost>
        </line>
        <line redirect="stratis_receptionist_main">"Enjoy your stay. Is there anything else I can do for you?"</line>
    </scene>
    <scene id="stratis_receptionist_info">
        <line>"Of course."</line>
        <choice link="stratis_receptionist_info_amenities">What amenities are available here?</choice>
        <choice link="stratis_receptionist_info_guests">Get a lot of high-profile guests here?</choice>
        <choice link="stratis_receptionist_info_rees">Is there someone staying here by the name of Abel Rees?</choice>
        <choice link="stratis_receptionist_combat">[Attack] Any last words?</choice>
        <choice link="stratis_receptionist_main_return">That's all.</choice>
    </scene>
    <scene id="stratis_receptionist_info_amenities">
        <line>The receptionist grins slightly.</line>
        <line redirect="stratis_receptionist_info">"Everything you could need. Five-star restaurant, rooftop pool. We also provide the fastest network access of any hotel in the area, included with every room."</line>
    </scene>
    <scene id="stratis_receptionist_info_guests">
        <line redirect="stratis_receptionist_info">"Why yes, of course. The Stratis is the best, and most secure, hotel in the area."</line>
    </scene>
    <scene id="stratis_receptionist_info_rees">
        <line>The receptionist narrows his eyes.</line>
        <line redirect="stratis_receptionist_info">"We can't disclose the identity of our guests to the public. As you can imagine, that would be bad for business."</line>
    </scene>
    <scene id="stratis_receptionist_combat">
        <line exit="true">
            <line>The receptionist smirks.</line>
            <line>"You think you're the first to try that here?"</line>
            <scriptPost>
                startCombat(actor=statHolder.target, target=statHolder.player);
            </scriptPost>
        </line>
    </scene>
    <scene id="stratis_receptionist_end">
        <line exit="true">"Very well. Have a lovely day."</line>
    </scene>
</data>