<data xmlns:xsi="http://www.w3.org/2001/XMLSchema-instance" xsi:noNamespaceSchemaLocation="../schemas/scenes.xsd">
    <scene id="cornerstore_shopkeeper_start">
        <line once="true" redirect="cornerstore_shopkeeper_main">
            <line>"Welcome, welcome! We've got everything you need here, all at a good price. What can I help you with?"</line>
        </line>
        <line redirect="cornerstore_shopkeeper_main">"Hello again! What can I help you with?"</line>
    </scene>
    <scene id="cornerstore_shopkeeper_main">
        <choice link="cornerstore_shopkeeper_andre">I'm looking for Andre Wallace. You seen him?</choice>
        <choice link="cornerstore_shopkeeper_andre_questions_repeat">I've got some more questions about Andre.</choice>
        <choice link="cornerstore_shopkeeper_end">Goodbye.</choice>
    </scene>
    <scene id="cornerstore_shopkeeper_end">
        <line exit="true">"'Till next time."</line>
    </scene>
    <scene id="cornerstore_shopkeeper_andre_questions_repeat">
        <condition>stat.scene("cornerstore_shopkeeper_andre_questions").triggered</condition>
        <line redirect="cornerstore_shopkeeper_andre_questions">"Go ahead."</line>
    </scene>
    <scene id="cornerstore_shopkeeper_andre">
        <condition>!stat.scene("cornerstore_shopkeeper_andre_questions").triggered</condition>
        <line>The shopkeeper looks down his glasses at you.</line>
        <line>"I see a lot of people. What makes you think I know anything about this 'Andre'?"</line>
        <choice link="cornerstore_shopkeeper_andre_truth">He lives in this building. Figured he might have dropped by once or twice.</choice>
        <choice link="cornerstore_shopkeeper_andre_intimidate">[Intimidate] I'm growing impatient. Tell me what you know or this gets messy.</choice>
        <choice link="cornerstore_shopkeeper_andre_bribe">[200 credits] Just a hunch. This might refresh your memory.</choice>
        <choice link="cornerstore_shopkeeper_andre_dismiss">You know what, you probably don't know anything anyway.</choice>
    </scene>
    <scene id="cornerstore_shopkeeper_andre_truth">
        <line>The shopkeeper narrows his eyes.</line>
        <line>"He might have. Can't say I'm inclined to tell you. Information is a commodity, and commodities do not come free."</line>
    </scene>
    <scene id="cornerstore_shopkeeper_andre_intimidate" type="select">
        <line redirect="cornerstore_shopkeeper_andre_questions">
            <condition>stat.player.skill_intimidation &gt;= 6</condition>
            <line>The shopkeeper puts up his hands.</line>
            <line>"Okay, okay. Fine. Ask your damn questions."</line>
        </line>
        <line>
            <line>The shopkeeper shakes his head.</line>
            <line>"If you think you can threaten me in my own store, you're wrong. There are much, much larger threats than yourself, and I'm very much prepared to defend myself and my property."</line>
        </line>
    </scene>
    <scene id="cornerstore_shopkeeper_andre_bribe">
        <condition>stat.player.money &gt;= 200</condition>
        <line redirect="cornerstore_shopkeeper_andre_questions">
            <scriptPre>stat.player.money = stat.player.money - 200;</scriptPre>
            <line>A smirk comes across the shopkeepers face. He straightens his glasses.</line>
            <line>"See, I like people who know how to conduct business. You've got questions, ask away."</line>
        </line>
    </scene>
    <scene id="cornerstore_shopkeeper_andre_dismiss">
        <line>The shopkeeper sighs.</line>
        <line>"Right, back to business then?"</line>
    </scene>
    <scene id="cornerstore_shopkeeper_andre_questions">
        <choice link="cornerstore_shopkeeper_andre_lastseen">When did you last see Andre?</choice>
        <choice link="cornerstore_shopkeeper_andre_regular">Was Andre a regular here?</choice>
        <choice link="cornerstore_shopkeeper_andre_strange">Was Andre acting strange when you last saw him?</choice>
        <choice link="cornerstore_shopkeeper_andre_work">Did Andre ever mention where he worked?</choice>
        <choice link="cornerstore_shopkeeper_andre_dismiss">That's all.</choice>
    </scene>
    <scene id="cornerstore_shopkeeper_andre_lastseen">
        <line redirect="cornerstore_shopkeeper_andre_questions">"A few weeks ago, at least. Very odd for him to just vanish like that. I figured he got a new job or something."</line>
    </scene>
    <scene id="cornerstore_shopkeeper_andre_regular">
        <line>The shopkeeper smirks.</line>
        <line redirect="cornerstore_shopkeeper_andre_questions">"He was here every morning, almost without fail. I think he must live in this building."</line>
    </scene>
    <scene id="cornerstore_shopkeeper_andre_strange">
        <line>"Not that I could tell. If I recall, he bought a couple bags of NutriChips. Oh, and a whole case of Nitron Energy."</line>
        <line>He shakes his head.</line>
        <line redirect="cornerstore_shopkeeper_andre_questions">"I guess if you're going to disappear, you've gotta stock up first. Although, come to think of it, I don't think I'd ever seen him buy Nitron Energy before. He was always a Diet guy."</line>
    </scene>
    <scene id="cornerstore_shopkeeper_andre_work">
        <line redirect="cornerstore_shopkeeper_andre_questions">"No, but I know a corporate man when I see one. Every move calculated, not one second wasted. Don't know if he's still working for one of them, but it's in his blood now. Seems like Andre handled it better than most though. Never lost his humanity."</line>
    </scene>
</data>