<data xmlns:xsi="http://www.w3.org/2001/XMLSchema-instance" xsi:noNamespaceSchemaLocation="../schemas/scenes.xsd">
    <scene id="nexus_bouncer_start" type="select">
        <line once="true">
            <line>The bouncer glances at you and frowns.</line>
            <line>"This club is for VIPs only. I don't know you, so you're not gettin' in."</line>
        </line>
        <line>The bouncer looks up at you. "Didn't I tell you to leave? VIPs only."</line>
        <choice link="nexus_bouncer_end">I have business with your boss.</choice>
        <choice link="nexus_bouncer_end">Sorry, my mistake.</choice>
    </scene>
    <scene id="nexus_bouncer_end">
        <line exit="true">He turns away.</line>
    </scene>
</data>